{
  "$schema": "./schemas/tb3_task_catalog.schema.json",
  "schema_version": "1.0",
  "dataset": "terminal-bench/terminal-bench-3",
  "release": "v3.0.0",
  "task_count": 74,
  "gpu_tasks": [
    "exam-pdf-eval",
    "fp8-rmsnorm-gemm",
    "jax-speedrun-gpu",
    "math-eval-grader"
  ],
  "compose_tasks": [
    "ctr-optimization",
    "cumulative-layout-shift",
    "erp-procurement-planning",
    "freight-dispatch-shift",
    "heat-pump-warranty",
    "intrastat-meldung",
    "kv-live-surgery",
    "legacy-utility-triage",
    "live-database-cutover",
    "medical-claims-processing",
    "nextjs-performance",
    "payments-pipeline-fix"
  ],
  "sidecar_artifact_tasks": [
    "ctr-optimization",
    "erp-procurement-planning",
    "heat-pump-warranty",
    "intrastat-meldung",
    "kv-live-surgery",
    "legacy-utility-triage",
    "live-database-cutover",
    "medical-claims-processing",
    "payments-pipeline-fix"
  ],
  "tasks": {
    "atrx-vep-crispr": {"digest": "sha256:3b8eb57602814aa63af12439e3eacb7ad5bee09efb6c6af023768994bf9220b4", "domain": "science", "subcategory": "biology", "coding_relevance": "domain", "capabilities": ["scientific-analysis", "structured-output"]},
    "batched-eval-parity": {"digest": "sha256:7926394b6c448ba8debd1cdd5b0bae777a0e4cbe0f1af608b61a8707f5d957c5", "domain": "ml", "subcategory": "evaluation", "coding_relevance": "adjacent_engineering", "capabilities": ["python", "ml", "testing", "data"]},
    "biped-contact-dynamics": {"digest": "sha256:ae2cc175efc37461de142d15b01a02718c7fb7a16f87b2720d0dd666e694cf0a", "domain": "science", "subcategory": "robotics", "coding_relevance": "adjacent_engineering", "capabilities": ["simulation", "numerical", "performance"]},
    "bun-sourcemap-leak": {"digest": "sha256:ac0b0f77da4e8f6c3904133033ec6d8591eb0d3f18205ab28104ea3cf2a5a07f", "domain": "software", "subcategory": "systems", "coding_relevance": "core_swe", "capabilities": ["javascript", "debugging", "security", "build-tools"]},
    "cad-model": {"digest": "sha256:55103abe25325dfa3717d08ef3d8e02dc8f8bc9adccaed92aab7e94a95b2049a", "domain": "hardware", "subcategory": "cad", "coding_relevance": "adjacent_engineering", "capabilities": ["cad", "artifact", "geometry"]},
    "cargo-flight-dispatch": {"digest": "sha256:2836dfe6eb2270fcbbfdb119c7cfae8495208a03a7fc691c2efff49bda5b3c61", "domain": "operations", "subcategory": "logistics", "coding_relevance": "domain", "capabilities": ["optimization", "structured-output", "planning"]},
    "cli-2ph-simplex": {"digest": "sha256:9f41a82565950c380501beb7f8ae33732e4ad526dc4c6ba9b3f37d66a7742a36", "domain": "software", "subcategory": "algorithms", "coding_relevance": "core_swe", "capabilities": ["algorithms", "optimization", "cli", "python"]},
    "coq-block-bound": {"digest": "sha256:4841b523aada2a5d94bb3687b0c107765ad8feac52bdab9e92fe1b59694f6abf", "domain": "science", "subcategory": "math", "coding_relevance": "adjacent_engineering", "capabilities": ["formal-methods", "coq", "proof"]},
    "ctr-optimization": {"digest": "sha256:9267570079b058061b7e6a87cdb30df4f04c5d5af3ce2c37c3da6be425e7c26d", "domain": "ml", "subcategory": "evaluation", "coding_relevance": "adjacent_engineering", "capabilities": ["optimization", "service", "compose", "ml"]},
    "cumulative-layout-shift": {"digest": "sha256:834205d9965467c2ed6f4516032658b0393ea0cb29c2442cfa75decf7ce026ff", "domain": "software", "subcategory": "frontend", "coding_relevance": "core_swe", "capabilities": ["frontend", "web", "performance", "compose"]},
    "data-anonymization": {"digest": "sha256:2d463025deb8bcc4c860f8a8e90c799435306e566e6c36af4b0df6d18e10a290", "domain": "software", "subcategory": "data-engineering", "coding_relevance": "core_swe", "capabilities": ["data", "privacy", "python", "structured-output"]},
    "distributed-dedup": {"digest": "sha256:f89d4536b2b884fe972215937f01397d9c6ebe5578499e4b192e67021c50310b", "domain": "software", "subcategory": "systems", "coding_relevance": "core_swe", "capabilities": ["distributed-systems", "algorithms", "performance", "python"]},
    "embedding-drift-monitor": {"digest": "sha256:cc93452e15459e00dcd817867428f4c49cd5a8831213ba4590f1372929cb262e", "domain": "ml", "subcategory": "inference", "coding_relevance": "adjacent_engineering", "capabilities": ["ml", "monitoring", "data", "python"]},
    "erp-procurement-planning": {"digest": "sha256:4be203d7f07954008fcca9869e2e6cc7b0fb6603bebc7e7d0ffe498e7fa2b843", "domain": "operations", "subcategory": "supply-chain", "coding_relevance": "domain", "capabilities": ["compose", "service", "planning", "structured-output"]},
    "exam-pdf-eval": {"digest": "sha256:d4f58d8db8098e854bbd2d98b0bcfee6ac14a3a6c69b606db55a8eb1230ff7da", "domain": "ml", "subcategory": "evaluation", "coding_relevance": "adjacent_engineering", "capabilities": ["ml", "pdf", "gpu", "multimodal"]},
    "fin-saccr-rwa": {"digest": "sha256:5b2103ac785d4a915207a2535fabf3815fea2c75cf4de01c79747a679facc2ad", "domain": "operations", "subcategory": "finance", "coding_relevance": "domain", "capabilities": ["finance", "quantitative", "structured-output"]},
    "fix-uautomizer-soundness": {"digest": "sha256:4a0ee1bf87f6d571214101881b0ac031c502fd20142bdf61f78755f58c4515e3", "domain": "software", "subcategory": "languages", "coding_relevance": "core_swe", "capabilities": ["formal-methods", "debugging", "c++", "correctness"]},
    "foodstuff-beta-activity": {"digest": "sha256:62f4c9e1d2c27c3ed174be4691d7d6c2df69f6466a51b266808c63cd111a9787", "domain": "science", "subcategory": "chemistry", "coding_relevance": "domain", "capabilities": ["scientific-analysis", "numerical", "structured-output"]},
    "formal-crypto": {"digest": "sha256:3d1bf9aadd4846379f4c2de10ffd21431444d7647ddbc302bd3cb2283051b4c4", "domain": "security", "subcategory": "cryptography", "coding_relevance": "adjacent_engineering", "capabilities": ["security", "cryptography", "formal-reasoning", "python"]},
    "fp8-rmsnorm-gemm": {"digest": "sha256:b2578e66cf87dfa6b64517c69fc1590a1777fb19f7bdff287f4d985ceedec2bd", "domain": "ml", "subcategory": "kernels", "coding_relevance": "adjacent_engineering", "capabilities": ["ml", "cuda", "gpu", "performance"]},
    "freecad-impeller": {"digest": "sha256:f1e641af087bf8feb3107355e207654021504cf53f6ec9b5d19f0dd5e54d7f86", "domain": "hardware", "subcategory": "cad", "coding_relevance": "adjacent_engineering", "capabilities": ["cad", "geometry", "artifact"]},
    "freecad-platform-drawing": {"digest": "sha256:70603e9566138b4e63165ebc4badcff5a83cbff187c397b78b0ff60073b8ffb4", "domain": "hardware", "subcategory": "cad", "coding_relevance": "adjacent_engineering", "capabilities": ["cad", "geometry", "artifact"]},
    "freecad-spring-clip": {"digest": "sha256:4c823616ab5c8cccfc58d828a3d770122cb70b3dadc02a859bce53acf11a22b1", "domain": "hardware", "subcategory": "cad", "coding_relevance": "adjacent_engineering", "capabilities": ["cad", "geometry", "artifact"]},
    "freight-dispatch-shift": {"digest": "sha256:b1bb32ad88e1892f33f8beea162cf1de283b3f5f0c6b8de65ce7646e94dc2bcd", "domain": "operations", "subcategory": "logistics", "coding_relevance": "domain", "capabilities": ["compose", "optimization", "service", "planning"]},
    "glycan-ms2-elucidation": {"digest": "sha256:6d4e3b6d5cf99e84d59b4292cd06f9faf00a2521760b56e3f5e8b5531298c088", "domain": "science", "subcategory": "chemistry", "coding_relevance": "domain", "capabilities": ["scientific-analysis", "data", "structured-output"]},
    "gpt2-codegolf": {"digest": "sha256:ea4f8bc8a4672f0c122fd0462381dea7151921b8fc37358d5b3370549a319c1f", "domain": "ml", "subcategory": "inference", "coding_relevance": "adjacent_engineering", "capabilities": ["ml", "optimization", "python", "performance"]},
    "gsea-proteomics": {"digest": "sha256:5dfb0c258b674ee0fea20e16f9996771e082cd4db59ee9408272c31d9397cfa1", "domain": "science", "subcategory": "biology", "coding_relevance": "domain", "capabilities": ["scientific-analysis", "data", "structured-output"]},
    "heat-pump-warranty": {"digest": "sha256:195e39da0c97ea45552d216f04b204d438ec397e1003300be3edc064aa9859b6", "domain": "operations", "subcategory": "claims", "coding_relevance": "domain", "capabilities": ["compose", "service", "structured-output", "workflow"]},
    "hof-topology-interpenetration": {"digest": "sha256:f8307547a260e56572e02e1d876c0b94af44be980aa7028ff1512c787d65e95a", "domain": "science", "subcategory": "chemistry", "coding_relevance": "domain", "capabilities": ["scientific-analysis", "geometry", "numerical"]},
    "html-js-filter": {"digest": "sha256:832a5b309edca4f1a7c728da5f1ca530c2712f20a0b7f1db6d1bb6e3171a8866", "domain": "security", "subcategory": "appsec", "coding_relevance": "core_swe", "capabilities": ["security", "javascript", "web", "debugging"]},
    "ico-path-patch": {"digest": "sha256:0115a4136189b48da79070f9b3004dc4e0dfc1a60725c5acebdd7f380d037d14", "domain": "security", "subcategory": "reverse-engineering", "coding_relevance": "core_swe", "capabilities": ["reverse-engineering", "binary", "debugging", "c"]},
    "interleaved-vigenere": {"digest": "sha256:83a4f0074137ab36629d33f3f4045d62b63b0feb83295ff7cb6636cbedd31bc0", "domain": "security", "subcategory": "cryptography", "coding_relevance": "adjacent_engineering", "capabilities": ["security", "cryptography", "algorithms"]},
    "intrastat-meldung": {"digest": "sha256:3385f3ea74661cc01464f0cb1155ec1553b755238a6f9b6293475e124c6edbc8", "domain": "operations", "subcategory": "compliance", "coding_relevance": "domain", "capabilities": ["compose", "service", "structured-output", "workflow"]},
    "jax-speedrun-gpu": {"digest": "sha256:c17111529f4eac64223dace5f734cbcb1f3ad542ec97e65cfdb6c0e7ffe9e98c", "domain": "ml", "subcategory": "training", "coding_relevance": "adjacent_engineering", "capabilities": ["ml", "jax", "gpu", "performance"]},